{
  "apiVersion": "samples.openbkn.ai/v1beta1",
  "kind": "Sample",
  "metadata": {
    "sampleId": "supply-chain",
    "version": "0.1.4",
    "displayName": "供应链",
    "summary": "用脱敏的订单、库存、BOM 和供应数据体验交付判断。",
    "authors": [
      "OpenBKN"
    ],
    "licenseNote": "脱敏历史回放，不能用于真实交付承诺。"
  },
  "spec": {
    "release": {
      "publishedAt": "2026-10-11T22:38:33Z",
      "defaultLocale": "zh-CN",
      "releaseNotes": [
        {
          "locale": "en-US",
          "path": "release-notes.en-US.md",
          "digest": "sha256:a2e420cb5f0840b64b8d91664c01bbf6d53f6f864307b7375616e5298904830a"
        },
        {
          "locale": "zh-CN",
          "path": "release-notes.zh-CN.md",
          "digest": "sha256:4c8227268dea8a8c7c003037adbe3c0178b64341c86750cd8aa942c13a2abe83"
        }
      ]
    },
    "requires": {
      "architectures": [
        "arm64",
        "amd64"
      ],
      "capabilities": [
        "vega.catalog",
        "knowledge-network.import.kn-json",
        "execution.function",
        "execution.skill"
      ],
      "installationProfiles": [
        "openbkn.ai/sample-install.v1"
      ],
      "platformVersion": ">=0.2.0 <0.3.0",
      "requiredExtensions": []
    },
    "artifacts": [
      {
        "id": "package",
        "type": "archive",
        "digest": "sha256:cb0d3f01568c490dca22fdd4ff6273dc83804f6726a3c5c8872e4eb670a14ad0",
        "locations": [
          "https://github.com/openbkn-ai/bkn-samples/releases/download/sample-supply-chain-v0.1.4/package.tar.gz"
        ]
      },
      {
        "id": "database-image",
        "type": "oci-image",
        "digest": "sha256:805317bc1ac93e58f4149e35a7a0a75057330d8888ca54526a354996f313fcd1",
        "locations": [
          "oci://ghcr.io/openbkn-ai/bkn-samples"
        ]
      }
    ],
    "experience": [
      {
        "type": "openbkn.ai/knowledge-network-detail.v1",
        "questions": [
          "这批需求能不能按当前库存和在制满足？",
          "缺料时有哪些可用替代料？"
        ],
        "contentId": "supply-network"
      }
    ],
    "extensions": {},
    "contents": {
      "knowledgeNetworks": [
        {
          "artifactId": "package",
          "directory": "kn",
          "format": "kn-json",
          "entrypoint": "supply_ontology_hand.json",
          "contentId": "supply-network"
        }
      ],
      "functionPackages": [
        {
          "artifactId": "package",
          "directory": "tools",
          "contentId": "supply-functions"
        }
      ],
      "skillPackages": [
        {
          "artifactId": "package",
          "directory": "skills",
          "contentId": "supply-skills"
        }
      ]
    },
    "delivery": {
      "profile": "openbkn.ai/sample-install.v1",
      "dataDependencies": [
        {
          "id": "supply-data",
          "artifactId": "database-image",
          "engine": "mariadb",
          "databaseName": "supply_demo_hand",
          "expectedTables": 12
        }
      ],
      "bindings": [
        {
          "objectTypeId": "supply_ontology_hand_inventory",
          "dataDependencyId": "supply-data",
          "tableName": "erp_real_time_inventory",
          "contentId": "supply-network"
        }
      ]
    }
  }
}
