{
  "apiVersion": "samples.openbkn.ai/v1beta1",
  "kind": "Sample",
  "metadata": {
    "sampleId": "order-basics",
    "version": "0.1.1",
    "displayName": "订单入门",
    "summary": "用三种产品和四张虚构订单体验对象查询与订单关联。",
    "authors": [
      "OpenBKN"
    ],
    "licenseNote": "Apache-2.0 · 虚构演示数据，不能用于真实业务决策。"
  },
  "spec": {
    "release": {
      "publishedAt": "2026-10-11T07:58:16Z",
      "defaultLocale": "zh-CN",
      "releaseNotes": [
        {
          "locale": "en-US",
          "path": "release-notes.en-US.md",
          "digest": "sha256:612c47f73f5c247135aed277ab4ae22530d6e197774268078d294fde288ea6aa"
        },
        {
          "locale": "zh-CN",
          "path": "release-notes.zh-CN.md",
          "digest": "sha256:d638cc8b73c90073af884e49b39cbd0b282b037084e30f8397953998a60aea5e"
        }
      ]
    },
    "requires": {
      "platformVersion": ">=0.2.0 <0.3.0",
      "capabilities": [
        "vega.catalog",
        "knowledge-network.import.kn-json"
      ],
      "architectures": [
        "amd64",
        "arm64"
      ],
      "requiredExtensions": [],
      "installationProfiles": [
        "openbkn.ai/sample-install.v1"
      ]
    },
    "artifacts": [
      {
        "id": "package",
        "type": "archive",
        "digest": "sha256:aabefbaa04a4ab3bbe1a8daa20292c6660f8187563cf0adc25380b53800eb6ce",
        "locations": [
          "https://github.com/openbkn-ai/bkn-samples/releases/download/sample-order-basics-v0.1.1/package.tar.gz"
        ]
      },
      {
        "id": "database-image",
        "type": "oci-image",
        "digest": "sha256:45d01ef8ec8ef947cd7d5307165cbe58e8f0624487b9103ec2259ddf742f4e06",
        "locations": [
          "oci://ghcr.io/openbkn-ai/bkn-samples"
        ]
      }
    ],
    "experience": [
      {
        "type": "openbkn.ai/knowledge-network-detail.v1",
        "questions": [
          "有哪些产品和订单？",
          "每张订单关联哪个产品？"
        ],
        "contentId": "order-network"
      }
    ],
    "extensions": {},
    "contents": {
      "knowledgeNetworks": [
        {
          "artifactId": "package",
          "directory": "kn",
          "format": "kn-json",
          "entrypoint": "order_basics.json",
          "contentId": "order-network"
        }
      ],
      "functionPackages": [],
      "skillPackages": []
    },
    "delivery": {
      "profile": "openbkn.ai/sample-install.v1",
      "dataDependencies": [
        {
          "id": "order-data",
          "artifactId": "database-image",
          "engine": "mariadb",
          "databaseName": "order_basics",
          "expectedTables": 2
        }
      ],
      "bindings": [
        {
          "objectTypeId": "products",
          "dataDependencyId": "order-data",
          "tableName": "products",
          "contentId": "order-network"
        },
        {
          "objectTypeId": "orders",
          "dataDependencyId": "order-data",
          "tableName": "orders",
          "contentId": "order-network"
        }
      ]
    }
  }
}
