{
  "apiVersion": "samples.openbkn.ai/v1beta1",
  "kind": "Sample",
  "metadata": {
    "sampleId": "financial-fibo-en-us",
    "version": "0.2.8",
    "displayName": "Financial Portfolio Operations (EN)",
    "summary": "Fictional securities trading, settlement, positions, valuation, exposure and mandate controls.",
    "authors": [
      "OpenBKN"
    ],
    "licenseNote": "MIT · Synthetic demonstration data / 虚构演示数据"
  },
  "spec": {
    "release": {
      "publishedAt": "2026-11-01T03:57:07Z",
      "defaultLocale": "en-US",
      "releaseNotes": [
        {
          "locale": "en-US",
          "path": "release-notes.en-US.md",
          "digest": "sha256:ed389d726fe42866f0ebb4b6b0a0a596d903977d9540400e0f82b96905d26287"
        },
        {
          "locale": "zh-CN",
          "path": "release-notes.zh-CN.md",
          "digest": "sha256:1e8811dd7f8d600ddf6d8ec175752e958f3bf05ce4d1f8b4ebea6378fcb3fc69"
        }
      ]
    },
    "requires": {
      "architectures": [
        "amd64",
        "arm64"
      ],
      "capabilities": [
        "vega.catalog",
        "knowledge-network.import.bkn-directory",
        "execution.function",
        "execution.skill",
        "sample.experience-set",
        "database.shared"
      ],
      "installationProfiles": [
        "openbkn.ai/sample-install.v1"
      ],
      "platformVersion": ">=0.2.1 <0.3.0",
      "requiredExtensions": []
    },
    "artifacts": [
      {
        "id": "package",
        "type": "archive",
        "digest": "sha256:29e787be8bb1fe860bd188a4d76b2b36f2b39586b73515448a3039a5325216c1",
        "sizeBytes": 993102,
        "locations": [
          "https://github.com/openbkn-ai/bkn-samples/releases/download/sample-financial-fibo-en-us-v0.2.8/package.tar.gz"
        ]
      }
    ],
    "experience": [
      {
        "type": "openbkn.ai/knowledge-network-detail.v1",
        "contentId": "financial-fibo-en-us-network",
        "questions": [
          "As of today, how many settlement instructions are not fully settled?",
          "PF-046's unsettled-sale receivable from CP-046 is over its limit. Which unsettled sales cause it?",
          "Under the March plan, which portfolios will breach a limit that they do not breach in February actuals?"
        ]
      }
    ],
    "extensions": {},
    "contents": {
      "knowledgeNetworks": [
        {
          "artifactId": "package",
          "directory": "kn",
          "format": "bkn-directory",
          "entrypoint": "network.bkn",
          "contentId": "financial-fibo-en-us-network"
        }
      ],
      "functionPackages": [
        {
          "artifactId": "package",
          "directory": "tools",
          "contentId": "financial-fibo-en-us-functions"
        }
      ],
      "skillPackages": [
        {
          "artifactId": "package",
          "directory": "skills",
          "contentId": "financial-fibo-en-us-skills"
        }
      ]
    },
    "delivery": {
      "profile": "openbkn.ai/sample-install.v1",
      "dataDependencies": [
        {
          "id": "financial-fibo-en-us-data",
          "artifactId": "package",
          "engine": "mariadb",
          "databaseName": "financial_fibo_en_us",
          "expectedTables": 20
        }
      ],
      "bindings": [
        {
          "contentId": "financial-fibo-en-us-network",
          "objectTypeId": "legal_entities",
          "dataDependencyId": "financial-fibo-en-us-data",
          "tableName": "legal_entities"
        },
        {
          "contentId": "financial-fibo-en-us-network",
          "objectTypeId": "legal_entity_identifiers",
          "dataDependencyId": "financial-fibo-en-us-data",
          "tableName": "legal_entity_identifiers"
        },
        {
          "contentId": "financial-fibo-en-us-network",
          "objectTypeId": "financial_instruments",
          "dataDependencyId": "financial-fibo-en-us-data",
          "tableName": "financial_instruments"
        },
        {
          "contentId": "financial-fibo-en-us-network",
          "objectTypeId": "security_identifiers",
          "dataDependencyId": "financial-fibo-en-us-data",
          "tableName": "security_identifiers"
        },
        {
          "contentId": "financial-fibo-en-us-network",
          "objectTypeId": "portfolios",
          "dataDependencyId": "financial-fibo-en-us-data",
          "tableName": "portfolios"
        },
        {
          "contentId": "financial-fibo-en-us-network",
          "objectTypeId": "accounts",
          "dataDependencyId": "financial-fibo-en-us-data",
          "tableName": "accounts"
        },
        {
          "contentId": "financial-fibo-en-us-network",
          "objectTypeId": "opening_positions",
          "dataDependencyId": "financial-fibo-en-us-data",
          "tableName": "opening_positions"
        },
        {
          "contentId": "financial-fibo-en-us-network",
          "objectTypeId": "trade_orders",
          "dataDependencyId": "financial-fibo-en-us-data",
          "tableName": "trade_orders"
        },
        {
          "contentId": "financial-fibo-en-us-network",
          "objectTypeId": "securities_transactions",
          "dataDependencyId": "financial-fibo-en-us-data",
          "tableName": "securities_transactions"
        },
        {
          "contentId": "financial-fibo-en-us-network",
          "objectTypeId": "settlement_instructions",
          "dataDependencyId": "financial-fibo-en-us-data",
          "tableName": "settlement_instructions"
        },
        {
          "contentId": "financial-fibo-en-us-network",
          "objectTypeId": "settlement_events",
          "dataDependencyId": "financial-fibo-en-us-data",
          "tableName": "settlement_events"
        },
        {
          "contentId": "financial-fibo-en-us-network",
          "objectTypeId": "positions",
          "dataDependencyId": "financial-fibo-en-us-data",
          "tableName": "positions"
        },
        {
          "contentId": "financial-fibo-en-us-network",
          "objectTypeId": "market_prices",
          "dataDependencyId": "financial-fibo-en-us-data",
          "tableName": "market_prices"
        },
        {
          "contentId": "financial-fibo-en-us-network",
          "objectTypeId": "fx_rates",
          "dataDependencyId": "financial-fibo-en-us-data",
          "tableName": "fx_rates"
        },
        {
          "contentId": "financial-fibo-en-us-network",
          "objectTypeId": "valuation_snapshots",
          "dataDependencyId": "financial-fibo-en-us-data",
          "tableName": "valuation_snapshots"
        },
        {
          "contentId": "financial-fibo-en-us-network",
          "objectTypeId": "issuer_exposures",
          "dataDependencyId": "financial-fibo-en-us-data",
          "tableName": "issuer_exposures"
        },
        {
          "contentId": "financial-fibo-en-us-network",
          "objectTypeId": "exposure_contributions",
          "dataDependencyId": "financial-fibo-en-us-data",
          "tableName": "exposure_contributions"
        },
        {
          "contentId": "financial-fibo-en-us-network",
          "objectTypeId": "counterparty_exposures",
          "dataDependencyId": "financial-fibo-en-us-data",
          "tableName": "counterparty_exposures"
        },
        {
          "contentId": "financial-fibo-en-us-network",
          "objectTypeId": "mandate_limits",
          "dataDependencyId": "financial-fibo-en-us-data",
          "tableName": "mandate_limits"
        },
        {
          "contentId": "financial-fibo-en-us-network",
          "objectTypeId": "limit_assessments",
          "dataDependencyId": "financial-fibo-en-us-data",
          "tableName": "limit_assessments"
        }
      ]
    }
  }
}
