{
  "apiVersion": "samples.openbkn.ai/v1beta1",
  "kind": "Sample",
  "metadata": {
    "sampleId": "world-cup",
    "version": "0.1.5",
    "displayName": "世界杯",
    "summary": "用公开的世界杯数据体验对象查询、多表关联、跨届分析和原生函数。",
    "authors": [
      "OpenBKN"
    ],
    "licenseNote": "CC-BY-SA 4.0 · Joshua C. Fjelstul"
  },
  "spec": {
    "release": {
      "publishedAt": "2026-10-19T06:02:15Z",
      "defaultLocale": "zh-CN",
      "releaseNotes": [
        {
          "locale": "en-US",
          "path": "release-notes.en-US.md",
          "digest": "sha256:e5ed5c3dbb5f54c31fb661f8ef58db289a8e49b4b1760bbad2a278ccd655c75e"
        },
        {
          "locale": "zh-CN",
          "path": "release-notes.zh-CN.md",
          "digest": "sha256:da30c5850cfe498baed53dc4e53e6403b3678ed0a7b5496953914f7a18b0357a"
        }
      ]
    },
    "requires": {
      "architectures": [
        "arm64",
        "amd64"
      ],
      "capabilities": [
        "vega.catalog",
        "knowledge-network.import.bkn-directory",
        "execution.function"
      ],
      "installationProfiles": [
        "openbkn.ai/sample-install.v1"
      ],
      "platformVersion": ">=0.2.0 <0.3.0",
      "requiredExtensions": []
    },
    "artifacts": [
      {
        "id": "package",
        "type": "archive",
        "digest": "sha256:41fbbfe63bba5f636675f3f25b024620cef94cf331471de7937fbf8f2036d83d",
        "locations": [
          "https://github.com/openbkn-ai/bkn-samples/releases/download/sample-world-cup-v0.1.5/package.tar.gz"
        ]
      },
      {
        "id": "database-image",
        "type": "oci-image",
        "digest": "sha256:805317bc1ac93e58f4149e35a7a0a75057330d8888ca54526a354996f313fcd1",
        "locations": [
          "oci://ghcr.io/openbkn-ai/bkn-samples"
        ]
      }
    ],
    "experience": [
      {
        "type": "openbkn.ai/knowledge-network-detail.v1",
        "questions": [
          "梅西在世界杯获得过哪些奖？",
          "近三届男足世界杯的冠军是谁？"
        ],
        "contentId": "worldcup-network"
      }
    ],
    "extensions": {},
    "contents": {
      "knowledgeNetworks": [
        {
          "artifactId": "package",
          "directory": "kn",
          "format": "bkn-directory",
          "entrypoint": "network.bkn",
          "contentId": "worldcup-network"
        }
      ],
      "functionPackages": [
        {
          "artifactId": "package",
          "directory": "tools",
          "contentId": "worldcup-functions"
        }
      ],
      "skillPackages": []
    },
    "delivery": {
      "profile": "openbkn.ai/sample-install.v1",
      "dataDependencies": [
        {
          "id": "worldcup-data",
          "artifactId": "database-image",
          "engine": "mariadb",
          "databaseName": "worldcup",
          "expectedTables": 27
        }
      ],
      "bindings": []
    }
  }
}
